{"application_id":"11111111-1111-4111-8111-111111111111","job_id":"22222222-2222-4222-8222-222222222222","resume_screening_status":"processing","resume_similarity_score":{"score":65,"reasoning":"Candidate shows strong proficiency in Python and REST API design, crucial for a Senior Backend Engineer. Evidence for distributed systems is present, though not explicitly stated. However, there are clear gaps in PostgreSQL, explicit Kubernetes experience, and GCP certification."},"requirement_matches":[{"requirement":"5+ years Python experience","requirement_type":"technical_skill","match_score":100,"evidence":"Resume states '5+ years building Python systems'. GitHub analysis shows Python as a primary language and activity across multiple Python repositories, including 'StrictAI' and 'predictive-maintenance-"},{"requirement":"distributed systems","requirement_type":"technical_skill","match_score":70,"evidence":"Resume highlights 'Hands-on with AI agents, RAG pipelines, automation, and cloud deployment' and 'Comfortable with containerization, CI/CD'. The 'StrictAI' repository uses `asyncio`, and 'predictive-m"},{"requirement":"PostgreSQL","requirement_type":"technical_skill","match_score":0,"evidence":"PostgreSQL is not mentioned in the resume, resume summary, or the GitHub repository analysis (dependencies or project descriptions)."},{"requirement":"REST API design","requirement_type":"technical_skill","match_score":90,"evidence":"Resume mentions 'FastAPI services' and 'building Python systems, FastAPI services'. FastAPI is a framework specifically for building RESTful APIs. The 'StrictAI' GitHub repository lists `fastapi` as a"},{"requirement":"Kubernetes experience","requirement_type":"technical_skill","match_score":30,"evidence":"Resume states 'Comfortable with containerization, CI/CD'. The 'predictive-maintenance-agent-n8n' GitHub repository is a 'dockerized-app'. While containerization is a prerequisite for Kubernetes, direc"},{"requirement":"GCP certification","requirement_type":"technical_skill","match_score":0,"evidence":"GCP certification is not mentioned in the resume, resume summary, or the GitHub repository analysis."}],"recommendation":"hold","recommendation_reasoning":"The candidate presents strong qualifications for must-have Python experience and REST API design. There is also reasonable evidence for distributed systems. However, the lack of PostgreSQL experience and direct Kubernetes experience, along with no GCP certification, are notable gaps that warrant a 'hold' for further evaluation rather than an immediate 'pass' or 'reject'.","red_flags":[],"sources_crawled":[],"metadata":{"schema_version":"1.0","model_version":"exaai-adk/gemini-2.5-flash","processed_at":"2026-06-09T11:32:03.065363Z","resume_text_chars":395,"job_desc_version":"1.4","agent_version":"0.1.0","screening_mode":"agent","llm_calls":0,"processing_time_ms":28104},"errors":[],"temp_sandbox_reports":[{"repo":"Manavv007/StrictAI","url":"https://github.com/Manavv007/StrictAI","provider":"cloud_run","clone_ok":false,"detected_stack":[],"repo_profile":{},"commands":[],"quality_signals":{},"risk_flags":[],"findings":[],"summary":"Sandbox evaluation has been scheduled in the background.","overall_assessment":"","confidence":"low","timed_out":false,"skipped_reason":"Deferred sandbox evaluation pending."},{"repo":"Manavv007/predictive-maintenance-agent-n8n","url":"https://github.com/Manavv007/predictive-maintenance-agent-n8n","provider":"cloud_run","clone_ok":false,"detected_stack":[],"repo_profile":{},"commands":[],"quality_signals":{},"risk_flags":[],"findings":[],"summary":"Sandbox evaluation has been scheduled in the background.","overall_assessment":"","confidence":"low","timed_out":false,"skipped_reason":"Deferred sandbox evaluation pending."}]}