{
  "application_id": "11111111-1111-4111-8111-111111111111",
  "job_id": "22222222-2222-4222-8222-222222222222",
  "resume_screening_status": "completed",
  "resume_similarity_score": {
    "score": 78,
    "reasoning": "Strong Python and distributed systems experience aligned with senior backend requirements."
  },
  "requirement_matches": [
    {
      "requirement": "5+ years Python",
      "requirement_type": "technical_skill",
      "match_score": 85,
      "evidence": "Resume lists Python in three roles over six years.",
      "source_quote": "Python, FastAPI, PostgreSQL"
    }
  ],
  "recommendation": "advance",
  "recommendation_reasoning": "Meets must-have technical skills with corroborating GitHub activity.",
  "red_flags": [],
  "sources_crawled": [
    {
      "url": "https://github.com/example-candidate",
      "title": "GitHub profile",
      "relevance": "high"
    }
  ],
  "metadata": {
    "schema_version": "1.0",
    "model_version": "exaai-adk/gemini-2.0-flash",
    "processed_at": "2026-06-04T12:00:00Z",
    "processing_time_ms": 8420,
    "resume_text_chars": 4200,
    "job_desc_version": "1.4",
    "agent_version": "0.1.0"
  },
  "errors": []
}
